<?xml version="1.0" encoding="UTF-8"?>
<!DOCTYPE suite SYSTEM "https://testng.org/testng-1.0.dtd">
<suite name="Github 1284 suite with listener">
    <listeners>
        <listener class-name="org.testng.listeners.samples.github1284.Listener1284" />
    </listeners>

    <test name="Github 1284 Test listener" preserve-order="true">
        <classes>
            <class name="org.testng.listeners.samples.github1284.Sample1284">
                <methods>
                    <include name="testWithListener"/>
                </methods>
            </class>
        </classes>
    </test>
</suite>