<?xml version="1.0" encoding="UTF-8"?>
<!DOCTYPE suite SYSTEM "https://testng.org/testng-1.0.dtd">
<suite name="Parent Suite">
   <listeners>
      <listener class-name="org.testng.listeners.samples.ExecutionListenerAndSuiteListener" />
   </listeners>
   <suite-files>
      <suite-file path="child.xml"/>
   </suite-files> 
   <test name="Parent Test">
        <classes>
            <class name="org.testng.listeners.samples.ExecutionListener1SampleTest"/>
        </classes>
    </test>
</suite>