<?xml version="1.0" encoding="UTF-8"?>
<!DOCTYPE suite SYSTEM "https://testng.org/testng-1.0.dtd">
<suite name="Suite Parallel 0">

  <suite-files>
    <suite-file path="./suite-parallel-3.xml" />
    <suite-file path="./suite-parallel-2.xml" />
    <suite-file path="./suite-parallel-1.xml" />
  </suite-files>

  <test name="Test0">
    <classes>
      <class name="org.testng.concurrency.samples.Sample2"/>
    </classes>
  </test>
</suite>