<?xml version="1.0" encoding="UTF-8"?>
<!DOCTYPE suite SYSTEM "https://testng.org/testng-1.0.dtd">
<suite name="Github 1284 suite" preserve-order="true">

    <suite-files>
        <suite-file path="github1284_withchildlistener.xml" />
    </suite-files>

    <test name="Github 1284 Test" preserve-order="true">
        <classes>
            <class name="test.listeners.github1284.Sample1284B">
                <methods>
                    <include name="testTheOrderOfInvokedMethods"/>
                </methods>
            </class>
        </classes>
    </test>
</suite>