<?xml version="1.0" encoding="UTF-8"?>
<!DOCTYPE suite SYSTEM "https://testng.org/testng-1.0.dtd">
<suite name="Multiple interceptors">
  
    <listeners>
        <listener class-name="org.testng.methodinterceptors.samples.multipleinterceptors.FirstInterceptor"/>
        <listener class-name="org.testng.methodinterceptors.samples.multipleinterceptors.SecondInterceptor"/>
        <listener class-name="org.testng.methodinterceptors.samples.multipleinterceptors.ThirdInterceptor"/>
    </listeners>
  
    <test name="MultipleInterceptors:Tests" preserve-order="true">
        <classes>
            <class name="org.testng.methodinterceptors.samples.multipleinterceptors.FooTest"/>
        </classes>
    </test>
</suite>
