<?xml version="1.0" encoding="UTF-8"?>
<!DOCTYPE suite SYSTEM "https://testng.org/testng-1.0.dtd">
<suite name="InheritedParametersSuite Child2">

  <parameter name="parameter2" value="c2p2"/>
  <parameter name="parameter3" value="c2p3"/>
  <test name="InheritedParametersTest Child2">
      <classes>
          <class name="org.testng.parameters.samples.InheritFromSuiteChild2" />
      </classes>
  </test>
  
  <suite-files>
    <suite-file path="./child3-suite.xml"/>
  </suite-files>

</suite>