<?xml version="1.0" encoding="UTF-8"?>
<!DOCTYPE suite SYSTEM "https://testng.org/testng-1.0.dtd">
<suite name="TESTNG-59 Suite" verbose="3" >
  <test name="TESTNG-59">
      <classes>
          <class name="org.testng.methodselection.samples.testng59.Test1">
              <methods>
                  <include name="test1"/>
              </methods>
          </class>
          <class name="org.testng.methodselection.samples.testng59.Test2">
              <methods>
                  <include name="test2"/>
              </methods>
          </class>
      </classes>
  </test>
</suite>