<?xml version="1.0" encoding="UTF-8"?>
<!DOCTYPE suite SYSTEM "https://testng.org/testng-1.0.dtd">
<suite name="Package" parallel="false" thread-count="4"
    data-provider-thread-count="3">

  <listeners>
    <listener class-name="test.tmp.BListener" />
  </listeners>

  <test name="A">
    <groups>
      <run>
        <include name="group-a" />
      </run>
    </groups>
    <packages>
      <package name="test.tmp.a" />
      <package name="test.tmp.b" />
    </packages>
  </test>

<!-- 
  <test name="B">
    <packages>
      <package name="test.tmp.b" />
    </packages>
  </test>
 -->
 
</suite>

